{
  "schemaVersion": 1,
  "generatedAtUtc": "2026-07-03T03:00:34.7628686Z",
  "repoRoot": "C:\\repo\\GitHub\\roslynkit",
  "files": [
    {
      "path": ".agents/skills/roslynkit-dev/SKILL.md",
      "extension": ".md",
      "area": "agents",
      "category": "skill"
    },
    {
      "path": ".agents/skills/roslynkit/SKILL.md",
      "extension": ".md",
      "area": "agents",
      "category": "skill"
    },
    {
      "path": ".claude/skills/roslynkit-dev",
      "extension": "",
      "area": ".claude",
      "category": "other"
    },
    {
      "path": ".codex/agents/atlas-csharp-mapper.toml",
      "extension": ".toml",
      "area": "codex",
      "category": "agent"
    },
    {
      "path": ".codex/agents/atlas-doc-mapper.toml",
      "extension": ".toml",
      "area": "codex",
      "category": "agent"
    },
    {
      "path": ".codex/agents/atlas-router.toml",
      "extension": ".toml",
      "area": "codex",
      "category": "agent"
    },
    {
      "path": ".codex/agents/atlas-test-mapper.toml",
      "extension": ".toml",
      "area": "codex",
      "category": "agent"
    },
    {
      "path": ".codex/agents/scout.toml",
      "extension": ".toml",
      "area": "codex",
      "category": "agent"
    },
    {
      "path": ".codex/atlas/feature-cards/atlas-prompt-caching.md",
      "extension": ".md",
      "area": "atlas",
      "category": "atlas"
    },
    {
      "path": ".codex/atlas/feature-cards/cli-routing.md",
      "extension": ".md",
      "area": "atlas",
      "category": "atlas"
    },
    {
      "path": ".codex/atlas/feature-cards/README.md",
      "extension": ".md",
      "area": "atlas",
      "category": "atlas"
    },
    {
      "path": ".codex/atlas/feature-cards/tooling-packaging.md",
      "extension": ".md",
      "area": "atlas",
      "category": "atlas"
    },
    {
      "path": ".codex/atlas/feature-cards/workspace-navigation.md",
      "extension": ".md",
      "area": "atlas",
      "category": "atlas"
    },
    {
      "path": ".codex/atlas/indexes/README.md",
      "extension": ".md",
      "area": "atlas",
      "category": "atlas"
    },
    {
      "path": ".codex/atlas/README.md",
      "extension": ".md",
      "area": "atlas",
      "category": "atlas"
    },
    {
      "path": ".codex/atlas/repo-map.md",
      "extension": ".md",
      "area": "atlas",
      "category": "atlas"
    },
    {
      "path": ".codex/atlas/scripts/rebuild-atlas.ps1",
      "extension": ".ps1",
      "area": "atlas",
      "category": "atlas"
    },
    {
      "path": ".codex/atlas/scripts/route.ps1",
      "extension": ".ps1",
      "area": "atlas",
      "category": "atlas"
    },
    {
      "path": ".codex/atlas/test-index.md",
      "extension": ".md",
      "area": "atlas",
      "category": "atlas"
    },
    {
      "path": ".codex/atlas/USAGE.md",
      "extension": ".md",
      "area": "atlas",
      "category": "atlas"
    },
    {
      "path": ".codex/config.toml",
      "extension": ".toml",
      "area": "codex",
      "category": "config"
    },
    {
      "path": ".editorconfig",
      "extension": ".editorconfig",
      "area": ".editorconfig",
      "category": "other"
    },
    {
      "path": ".gitattributes",
      "extension": ".gitattributes",
      "area": ".gitattributes",
      "category": "other"
    },
    {
      "path": ".gitignore",
      "extension": ".gitignore",
      "area": ".gitignore",
      "category": "other"
    },
    {
      "path": ".vscode/settings.json",
      "extension": ".json",
      "area": ".vscode",
      "category": "config"
    },
    {
      "path": ".vscode/tasks.json",
      "extension": ".json",
      "area": ".vscode",
      "category": "config"
    },
    {
      "path": "AGENTS.md",
      "extension": ".md",
      "area": "AGENTS.md",
      "category": "doc"
    },
    {
      "path": "CLAUDE.md",
      "extension": ".md",
      "area": "CLAUDE.md",
      "category": "config"
    },
    {
      "path": "Directory.Build.props",
      "extension": ".props",
      "area": "Directory.Build.props",
      "category": "config"
    },
    {
      "path": "Directory.Packages.props",
      "extension": ".props",
      "area": "Directory.Packages.props",
      "category": "config"
    },
    {
      "path": "docs/dev-install.md",
      "extension": ".md",
      "area": "docs",
      "category": "doc"
    },
    {
      "path": "docs/dotnet-tool-release.md",
      "extension": ".md",
      "area": "docs",
      "category": "doc"
    },
    {
      "path": "docs/local-repository-reference.md",
      "extension": ".md",
      "area": "docs",
      "category": "doc"
    },
    {
      "path": "docs/markdown-output-format.md",
      "extension": ".md",
      "area": "docs",
      "category": "doc"
    },
    {
      "path": "docs/roslyn-lsp-commands.md",
      "extension": ".md",
      "area": "docs",
      "category": "doc"
    },
    {
      "path": "docs/skill-maintenance.md",
      "extension": ".md",
      "area": "docs",
      "category": "doc"
    },
    {
      "path": "global.json",
      "extension": ".json",
      "area": "global.json",
      "category": "config"
    },
    {
      "path": "LICENSE",
      "extension": "",
      "area": "LICENSE",
      "category": "other"
    },
    {
      "path": "README.md",
      "extension": ".md",
      "area": "README.md",
      "category": "doc"
    },
    {
      "path": "RoslynKit.slnx",
      "extension": ".slnx",
      "area": "RoslynKit.slnx",
      "category": "config"
    },
    {
      "path": "scripts/install-roslynkit-dev.ps1",
      "extension": ".ps1",
      "area": "scripts",
      "category": "script"
    },
    {
      "path": "scripts/prepare-roslynkit-package.ps1",
      "extension": ".ps1",
      "area": "scripts",
      "category": "script"
    },
    {
      "path": "scripts/RoslynKit.Packaging.ps1",
      "extension": ".ps1",
      "area": "scripts",
      "category": "script"
    },
    {
      "path": "src/RoslynKit/BuiltinCommand.cs",
      "extension": ".cs",
      "area": "src",
      "category": "source"
    },
    {
      "path": "src/RoslynKit/BuiltinCommandRegistry.cs",
      "extension": ".cs",
      "area": "src",
      "category": "source"
    },
    {
      "path": "src/RoslynKit/CliApplication.cs",
      "extension": ".cs",
      "area": "src",
      "category": "source"
    },
    {
      "path": "src/RoslynKit/CliParser.cs",
      "extension": ".cs",
      "area": "src",
      "category": "source"
    },
    {
      "path": "src/RoslynKit/CompactModels.cs",
      "extension": ".cs",
      "area": "src",
      "category": "source"
    },
    {
      "path": "src/RoslynKit/CompactProjection.cs",
      "extension": ".cs",
      "area": "src",
      "category": "source"
    },
    {
      "path": "src/RoslynKit/MarkdownProjection.cs",
      "extension": ".cs",
      "area": "src",
      "category": "source"
    },
    {
      "path": "src/RoslynKit/PackageReadme.md",
      "extension": ".md",
      "area": "src",
      "category": "config"
    },
    {
      "path": "src/RoslynKit/PositionResolver.cs",
      "extension": ".cs",
      "area": "src",
      "category": "source"
    },
    {
      "path": "src/RoslynKit/Program.cs",
      "extension": ".cs",
      "area": "src",
      "category": "source"
    },
    {
      "path": "src/RoslynKit/RoslynCommandExecutor.cs",
      "extension": ".cs",
      "area": "src",
      "category": "source"
    },
    {
      "path": "src/RoslynKit/RoslynDocumentFilters.cs",
      "extension": ".cs",
      "area": "src",
      "category": "source"
    },
    {
      "path": "src/RoslynKit/RoslynKit.csproj",
      "extension": ".csproj",
      "area": "src",
      "category": "config"
    },
    {
      "path": "src/RoslynKit/RoslynModels.cs",
      "extension": ".cs",
      "area": "src",
      "category": "source"
    },
    {
      "path": "src/RoslynKit/RoslynSignatureHelpService.cs",
      "extension": ".cs",
      "area": "src",
      "category": "source"
    },
    {
      "path": "src/RoslynKit/RoslynSymbolResolver.cs",
      "extension": ".cs",
      "area": "src",
      "category": "source"
    },
    {
      "path": "src/RoslynKit/RoslynSymbolSearch.cs",
      "extension": ".cs",
      "area": "src",
      "category": "source"
    },
    {
      "path": "src/RoslynKit/RoslynWorkspaceLoader.cs",
      "extension": ".cs",
      "area": "src",
      "category": "source"
    },
    {
      "path": "src/RoslynKit/TextProjection.cs",
      "extension": ".cs",
      "area": "src",
      "category": "source"
    },
    {
      "path": "tests/FixtureWorkspace/App/.editorconfig",
      "extension": ".editorconfig",
      "area": "tests",
      "category": "fixture"
    },
    {
      "path": "tests/FixtureWorkspace/App/App.csproj",
      "extension": ".csproj",
      "area": "tests",
      "category": "fixture"
    },
    {
      "path": "tests/FixtureWorkspace/App/notes.txt",
      "extension": ".txt",
      "area": "tests",
      "category": "fixture"
    },
    {
      "path": "tests/FixtureWorkspace/App/Source.cs",
      "extension": ".cs",
      "area": "tests",
      "category": "fixture"
    },
    {
      "path": "tests/RoslynKit.AtlasPromptCacheProbe/AtlasPromptProbe.cs",
      "extension": ".cs",
      "area": "tests",
      "category": "other"
    },
    {
      "path": "tests/RoslynKit.AtlasPromptCacheProbe/Program.cs",
      "extension": ".cs",
      "area": "tests",
      "category": "other"
    },
    {
      "path": "tests/RoslynKit.AtlasPromptCacheProbe/RoslynKit.AtlasPromptCacheProbe.csproj",
      "extension": ".csproj",
      "area": "tests",
      "category": "config"
    },
    {
      "path": "tests/RoslynKit.Tests/AtlasPromptCacheProbeTests.cs",
      "extension": ".cs",
      "area": "tests",
      "category": "test"
    },
    {
      "path": "tests/RoslynKit.Tests/CliOutputTests.cs",
      "extension": ".cs",
      "area": "tests",
      "category": "test"